{
  "version": 2,
  "description": "MovieCloud authorized web catalog. Add only media that MovieCloud owns or is explicitly licensed to distribute.",
  "featured": [],
  "trending": [],
  "titles": [],
  "providers": {
    "BasPlayFTP": {"sources": []},
    "CinePlexFTP": {"sources": []},
    "CTGFTP": {"sources": []},
    "DhakaFTP": {"sources": []},
    "DiscoveryFTP": {"sources": []},
    "HiAnime": {"sources": []},
    "KhulnaPlex": {"sources": []},
    "MojaLoss": {"sources": []},
    "MovieHaat": {"sources": []},
    "MovieLinkBD": {"sources": []},
    "OnlineMovies": {"sources": []},
    "YouTube": {"sources": []},
    "YouTubeKids": {"sources": []},
    "Zoryva": {"sources": []},
    "MovieBox": {"sources": []}
  }
}
